id;ficha;especie;nombre.especie;fecha_orig;fecha;anio;mes;estacion;lugar_orig;muni_orig;id_lugar;lugar;fmt_lugar;muni;codmun;causa_orig;causa;muerte;observa;lesion;cuerpo;estado
8;9405 - 1998-2010;Caretta caretta;Tortuga Boba;18/09/2010;18/09/2010;2010;Septiembre;Otoño;Tajao;NA;497;Tajao;Urbanización Tajao, 38588, Arico, Santa Cruz de Tenerife, Islas Canarias;Arico;38005;Indeterminado;Indeterminado;No;Descompuesta, sinmarcas aparentes;NA;NA;NA
10;9387 - 1998-2010;Caretta caretta;Tortuga Boba;08/09/2010;08/09/2010;2010;Septiembre;Otoño;Puertito;NA;409;Puertito;El Puertito, 38479, Los Silos, Santa Cruz de Tenerife, Islas Canarias;Silos, Los;38042;Indeterminado;Indeterminado;No;Descompuesta;NA;NA;NA
11;9361 - 1998-2010;Caretta caretta;Tortuga Boba;27/08/2010;27/08/2010;2010;Agosto;Verano;Teno;NA;504;Teno;Teno, Buenavista del Norte, Santa Cruz de Tenerife, Islas Canarias;Buenavista del Norte;38010;Indeterminado;Indeterminado;No;NA;NA;NA;NA
18;9287 - 1998-2010;Caretta caretta;Tortuga Boba;27/07/2010;27/07/2010;2010;Julio;Verano;Los Cristianos;NA;220;Los Cristianos;Los Cristianos, Arona, Santa Cruz de Tenerife, Islas Canarias;Arona;38006;Indeterminado;Indeterminado;No;APN;NA;NA;NA
31;8720 - 1998-2010;Caretta caretta;Tortuga Boba;19/12/2009;19/12/2009;2009;Diciembre;Invierno;Punta de Teno;NA;456;Punta De Teno;Calle Punta de Teno, 38111, Alisios, Santa Cruz de Tenerife, Islas Canarias;Santa Cruz de Tenerife;38038;Indeterminado;Indeterminado;No;Podrida.;NA;NA;Putrefacta
32;8706 - 1998-2010;Caretta caretta;Tortuga Boba;11/12/2009;11/12/2009;2009;Diciembre;Invierno;Muelle (Pto.de la Cruz);NA;262;Muelle (pto.de La Cruz);Carretera del Puerto de la Cruz, 38314, La Orotava, Santa Cruz de Tenerife, Islas Canarias;Orotava, La;38026;Indeterminado;Indeterminado;No;Descompuesta.;NA;NA;NA
33;8693 - 1998-2010;Caretta caretta;Tortuga Boba;25/11/2009;25/11/2009;2009;Noviembre;Otoño;El Cabezo (El Médano);NA;93;El Cabezo (el Medano);El Cabezo, Granadilla de Abona, Santa Cruz de Tenerife, Islas Canarias;Granadilla de Abona;38017;Indeterminado;Indeterminado;No;Descompuesta.;NA;NA;NA
57;8484 - 1998-2010;Caretta caretta;Tortuga Boba;15/08/2009;15/08/2009;2009;Agosto;Verano;Los Gigantes;NA;227;Los Gigantes;Los Gigantes;Santiago del Teide;38040;Indeterminado;Indeterminado;No;Avistada flotando a la deriva, musgo en caparazón.;NA;Caparazón;NA
71;8244 - 1998-2010;Caretta caretta;Tortuga Boba;09/06/2009;09/06/2009;2009;Junio;Verano;Los Cristianos;NA;220;Los Cristianos;Los Cristianos, Arona, Santa Cruz de Tenerife, Islas Canarias;Arona;38006;Indeterminado;Indeterminado;No;Aleta Delantera derecha inflamada, enredad a los restos de un globo de radio sonda (meteorología) .;Enredadas;Aleta;Infección
75;8160 - 1998-2010;Caretta caretta;Tortuga Boba;15/05/2009;15/05/2009;2009;Mayo;Primavera;El Médano;NA;100;El Medano;El Médano, Granadilla de Abona, Santa Cruz de Tenerife, Islas Canarias;Granadilla de Abona;38017;Indeterminado;Indeterminado;No;Descompuesta y con golpe en la cabeza;NA;Cabeza;NA
88;7760 - 1998-2010;Caretta caretta;Tortuga Boba;29/08/2008;29/08/2008;2008;Agosto;Verano;Las Americas;NA;192;Las Americas;Urbanización Las Américas, 38650, Arona, Santa Cruz de Tenerife, Islas Canarias;Arona;38006;Indeterminado;Indeterminado;No;descompuesta;NA;NA;NA
92;7742 - 1998-2010;Caretta caretta;Tortuga Boba;19/08/2008;19/08/2008;2008;Agosto;Verano;Benijo;NA;38;Benijo;Benijo, Santa Cruz de Tenerife, Islas Canarias;Santa Cruz de Tenerife;38038;Indeterminado;Indeterminado;No;Muy grande, 60 a 70 kg.;NA;NA;NA
97;7665 - 1998-2010;Caretta caretta;Tortuga Boba;24/07/2008;24/07/2008;2008;Julio;Verano;Los Cristianos;NA;220;Los Cristianos;Los Cristianos, Arona, Santa Cruz de Tenerife, Islas Canarias;Arona;38006;Indeterminado;Indeterminado;No;Descompuesta, no enmallada;Enredadas;NA;NA
235;5845 - 1998-2010;Caretta caretta;Tortuga Boba;08/06/2006;08/06/2006;2006;Junio;Verano;Los Patos;NA;232;Los Patos;Los Patos;Orotava, La;38026;Indeterminado;Indeterminado;No;Descompuesta;NA;NA;NA
250;5613 - 1998-2010;Caretta caretta;Tortuga Boba;08/02/2006;08/02/2006;2006;Febrero;Invierno;Pelada, El Médano;NA;295;Pelada, El Medano;El Médano, Granadilla de Abona, Santa Cruz de Tenerife, Islas Canarias;Granadilla de Abona;38017;Indeterminado;Indeterminado;No;Totalmente descompuesta;NA;NA;NA
278;5227 - 1998-2010;Caretta caretta;Tortuga Boba;19/07/2005;19/07/2005;2005;Julio;Verano;El Medano;NA;99;El Medano;El Médano, Granadilla de Abona, Santa Cruz de Tenerife, Islas Canarias;Granadilla de Abona;38017;Indeterminado;Indeterminado;No;Se la llevó el mar, solo quedaron restos de piel, entregados en el CRFS;NA;NA;NA
294;5006 - 1998-2010;Caretta caretta;Tortuga Boba;31/05/2005;31/05/2005;2005;Mayo;Primavera;El Tablado;NA;123;El Tablado;El Tablado, Garafía, Santa Cruz de Tenerife, Islas Canarias;Santa Cruz de Tenerife;38038;Indeterminado;Indeterminado;No;Muy descompuesta;NA;NA;NA
310;4710 - 1998-2010;Caretta caretta;Tortuga Boba;13/10/2004;13/10/2004;2004;Octubre;Otoño;Muelle Rivera;NA;285;Muelle Rivera;Calle Rivera, 38800, San Sebastián de la Gomera, Santa Cruz de Tenerife, Islas Canarias;Santa Cruz de Tenerife;38038;Indeterminado;Indeterminado;No;Le faltan las 4 aletas, descompuesta;NA;Aleta;NA
311;4700 - 1998-2010;Caretta caretta;Tortuga Boba;10/10/2004;10/10/2004;2004;Octubre;Otoño;El Médano;NA;100;El Medano;El Médano, Granadilla de Abona, Santa Cruz de Tenerife, Islas Canarias;Granadilla de Abona;38017;Indeterminado;Indeterminado;No;ToTalmente descompuesta, la llevan al PIRS;NA;NA;NA
313;4683 - 1998-2010;Caretta caretta;Tortuga Boba;03/10/2004;03/10/2004;2004;Octubre;Otoño;Punta de Teno;NA;456;Punta De Teno;Calle Punta de Teno, 38111, Alisios, Santa Cruz de Tenerife, Islas Canarias;Santa Cruz de Tenerife;38038;Indeterminado;Indeterminado;No;APN;NA;NA;NA
314;4629 - 1998-2010;Caretta caretta;Tortuga Boba;14/09/2004;14/09/2004;2004;Septiembre;Otoño;Punta Larga;NA;460;Punta Larga;I. E. S. Punta Larga;NA;NA;Indeterminado;Indeterminado;No;NA;NA;NA;NA
321;4550 - 1998-2010;Caretta caretta;Tortuga Boba;10/08/2004;10/08/2004;2004;Agosto;Verano;Valleseco;NA;515;Valleseco;Valleseco, Santa Cruz de Tenerife, Islas Canarias;Santa Cruz de Tenerife;38038;Indeterminado;Indeterminado;No;Dicen que flotaba;NA;NA;NA
324;4515 - 1998-2010;Caretta caretta;Tortuga Boba;30/07/2004;30/07/2004;2004;Julio;Verano;Pto, Colón;NA;401;Pto, Colon;Centro Comercial Puerto Colón;Adeje;38001;Indeterminado;Indeterminado;No;APN;NA;NA;NA
325;4471 - 1998-2010;Caretta caretta;Tortuga Boba;22/07/2004;22/07/2004;2004;Julio;Verano;Playa Paraiso;NA;368;Playa Paraiso;Urbanización Playa Paraíso, 38678, Adeje, Santa Cruz de Tenerife, Islas Canarias;Adeje;38001;Indeterminado;Indeterminado;No;En estado de descomposición;NA;NA;NA
326;4470 - 1998-2010;Caretta caretta;Tortuga Boba;22/07/2004;22/07/2004;2004;Julio;Verano;Playa El Apio, Valle Guerra;NA;337;Playa El Apio, Valle Guerra;Valle de Guerra, San Cristóbal de La Laguna, Santa Cruz de Tenerife, Islas Canarias;San Cristóbal de La Laguna;38023;Indeterminado;Indeterminado;No;En estado de descomposición;NA;NA;NA
330;4447 - 1998-2010;Caretta caretta;Tortuga Boba;15/07/2004;15/07/2004;2004;Julio;Verano;Tembel;NA;501;Tembel;Calle Témbel, 38296, Geneto, San Cristóbal de La Laguna, Santa Cruz de Tenerife, Islas Canarias;San Cristóbal de La Laguna;38023;Indeterminado;Indeterminado;No;NA;NA;NA;NA
370;3601 - 1998-2010;Caretta caretta;Tortuga Boba;04/07/2003;04/07/2003;2003;Julio;Verano;Los Abrigos;NA;215;Los Abrigos;Los Abrigos, Granadilla de Abona, Santa Cruz de Tenerife, Islas Canarias;Granadilla de Abona;38017;Indeterminado;Indeterminado;Si;NA;NA;NA;NA
377;3557 - 1998-2010;Caretta caretta;Tortuga Boba;26/06/2003;26/06/2003;2003;Junio;Verano;Puntilla Negra;NA;464;Puntilla Negra;Puntilla, Santa Úrsula, Santa Cruz de Tenerife, Islas Canarias;Santa Úrsula;38039;Indeterminado;Indeterminado;No;Podrida y sin cabeza;NA;Cabeza;Putrefacta
384;3501 - 1998-2010;Caretta caretta;Tortuga Boba;15/06/2003;15/06/2003;2003;Junio;Verano;Puerto Colón;NA;428;Puerto Colon;Puerto, Tazacorte, Santa Cruz de Tenerife, Islas Canarias;Adeje;38001;Indeterminado;Indeterminado;No;NA;NA;NA;NA
385;3499 - 1998-2010;Caretta caretta;Tortuga Boba;15/06/2003;15/06/2003;2003;Junio;Verano;Dársena Pesquera;NA;88;Darsena Pesquera;Calle Dársena Pesquera, 38120, San Andrés, Santa Cruz de Tenerife, Islas Canarias;Santa Cruz de Tenerife;38038;Indeterminado;Indeterminado;No;APN;NA;NA;NA
387;3492 - 1998-2010;Caretta caretta;Tortuga Boba;11/06/2003;11/06/2003;2003;Junio;Verano;Las Eras;NA;198;Las Eras;Las Eras, Fasnia, Santa Cruz de Tenerife, Islas Canarias;Fasnia;38012;Indeterminado;Indeterminado;No;En Avanzado estado de descomposición;NA;NA;NA
400;3375 - 1998-2010;Caretta caretta;Tortuga Boba;15/05/2003;15/05/2003;2003;Mayo;Primavera;El Poris;NA;107;El Poris;El Poris, Villa de Mazo, Santa Cruz de Tenerife, Islas Canarias;Arico;38005;Indeterminado;Indeterminado;No;NA;NA;NA;NA
401;3374 - 1998-2010;Caretta caretta;Tortuga Boba;15/05/2003;15/05/2003;2003;Mayo;Primavera;Tabaibal del Poris;NA;489;Tabaibal Del Poris;El Poris, Villa de Mazo, Santa Cruz de Tenerife, Islas Canarias;Arico;38005;Indeterminado;Indeterminado;No;Descompuesta;NA;NA;NA
422;3137 - 1998-2010;Caretta caretta;Tortuga Boba;20/11/2002;20/11/2002;2002;Noviembre;Otoño;Muelle;NA;259;Muelle;Travesía al Muelle, 38509, Candelaria, Santa Cruz de Tenerife, Islas Canarias;Candelaria;38011;Indeterminado;Indeterminado;No;NA;NA;NA;NA
423;3132 - 1998-2010;Caretta caretta;Tortuga Boba;17/11/2002;17/11/2002;2002;Noviembre;Otoño;Las Maretas;NA;207;Las Maretas;Calle Las Maretas, 38632, Arona, Santa Cruz de Tenerife, Islas Canarias;Arona;38006;Indeterminado;Indeterminado;No;NA;NA;NA;NA
451;2819 - 1998-2010;Caretta caretta;Tortuga Boba;10/07/2002;10/07/2002;2002;Julio;Verano;Tabaibal de El Poris;NA;488;Tabaibal De El Poris;El Poris, Villa de Mazo, Santa Cruz de Tenerife, Islas Canarias;Arico;38005;Indeterminado;Indeterminado;No;NA;NA;NA;NA
452;2818 - 1998-2010;Caretta caretta;Tortuga Boba;10/07/2002;10/07/2002;2002;Julio;Verano;Tabaibal de El Poris;NA;488;Tabaibal De El Poris;El Poris, Villa de Mazo, Santa Cruz de Tenerife, Islas Canarias;Arico;38005;Indeterminado;Indeterminado;No;NA;NA;NA;NA
457;2764 - 1998-2010;Caretta caretta;Tortuga Boba;24/06/2002;24/06/2002;2002;Junio;Verano;Puerto Colón;NA;428;Puerto Colon;Puerto, Tazacorte, Santa Cruz de Tenerife, Islas Canarias;Adeje;38001;Indeterminado;Indeterminado;No;APN. Pequeña;NA;NA;NA
465;2645 - 1998-2010;Caretta caretta;Tortuga Boba;18/05/2002;18/05/2002;2002;Mayo;Primavera;Candelaria;NA;53;Candelaria;Candelaria, Santa Cruz de Tenerife, Islas Canarias;Candelaria;38011;Indeterminado;Indeterminado;No;Descompuesta;NA;NA;NA
469;2553 - 1998-2010;Caretta caretta;Tortuga Boba;14/04/2002;14/04/2002;2002;Abril;Primavera;Pta. Hidalgo (Faro);NA;393;Pta. Hidalgo (faro);Calle Hidalgo, 38180, Maria Jiménez, Santa Cruz de Tenerife, Islas Canarias;Santa Cruz de Tenerife;38038;Indeterminado;Indeterminado;No;Estaba podrida;NA;NA;Putrefacta
477;2434 - 1998-2010;Caretta caretta;Tortuga Boba;22/11/2001;22/11/2001;2001;Noviembre;Otoño;Los Abrigos;NA;215;Los Abrigos;Los Abrigos, Granadilla de Abona, Santa Cruz de Tenerife, Islas Canarias;Granadilla de Abona;38017;Indeterminado;Indeterminado;No;NA;NA;NA;NA
485;2289 - 1998-2010;Caretta caretta;Tortuga Boba;20/08/2001;20/08/2001;2001;Agosto;Verano;Pto. Colón;NA;402;Pto. Colon;Centro Comercial Puerto Colón;Adeje;38001;Indeterminado;Indeterminado;No;Aparentemente no tiene nada;NA;NA;NA
532;1956 - 1998-2010;Caretta caretta;Tortuga Boba;16/05/2001;16/05/2001;2001;Mayo;Primavera;Playa de Candelaria;NA;307;Playa De Candelaria;Plaza Candelaria, 38780, Tijarafe, Santa Cruz de Tenerife, Islas Canarias;Arico;38005;Indeterminado;Indeterminado;No;En Muy Mal Estado, Descompuesta       L.R. 20 cm;NA;NA;NA
534;1944 - 1998-2010;Caretta caretta;Tortuga Boba;14/05/2001;14/05/2001;2001;Mayo;Primavera;Muelle viejo Los Cristianos;NA;286;Muelle Viejo Los Cristianos;Los Cristianos, Arona, Santa Cruz de Tenerife, Islas Canarias;Arona;38006;Indeterminado;Indeterminado;No;NA;NA;NA;NA
535;1943 - 1998-2010;Caretta caretta;Tortuga Boba;14/05/2001;14/05/2001;2001;Mayo;Primavera;Parque Marítimo;NA;293;Parque Maritimo;Parque Marítimo;Santa Cruz de Tenerife;38038;Indeterminado;Indeterminado;No;NA;NA;NA;NA
536;1920 - 1998-2010;Caretta caretta;Tortuga Boba;04/05/2001;04/05/2001;2001;Mayo;Primavera;Playa del Beril;NA;331;Playa Del Beril;Playa El Beril;Adeje;38001;Indeterminado;Indeterminado;No;Bastante descompuesta;NA;NA;NA
547;1653 - 1998-2010;Caretta caretta;Tortuga Boba;30/09/2000;30/09/2000;2000;Septiembre;Otoño;Playa La Puente,,  El Tablado;NA;352;Playa La Puente,,  El Tablado;Camino El Tablado, 38759, Los Llanos de Aridane, Santa Cruz de Tenerife, Islas Canarias;Santa Cruz de Tenerife;38038;Indeterminado;Indeterminado;Si;Recogida muerta y descompuesta. L.R.:39   L.C.:23  A.R.:29   A.C.:33;NA;NA;Muerta
550;1582 - 1998-2010;Caretta caretta;Tortuga Boba;11/09/2000;11/09/2000;2000;Septiembre;Otoño;Valleseco;NA;515;Valleseco;Valleseco, Santa Cruz de Tenerife, Islas Canarias;Santa Cruz de Tenerife;38038;Indeterminado;Indeterminado;Si;Totalmente descompuesta.;NA;NA;NA
554;1559 - 1998-2010;Caretta caretta;Tortuga Boba;04/09/2000;04/09/2000;2000;Septiembre;Otoño;Muelle de Los Cristianos;NA;268;Muelle De Los Cristianos;Carretera a los Cristianos, 38627, Arona, Santa Cruz de Tenerife, Islas Canarias;Arona;38006;Indeterminado;Indeterminado;No;No tiene nada.;NA;NA;NA
557;1532 - 1998-2010;Caretta caretta;Tortuga Boba;21/08/2000;21/08/2000;2000;Agosto;Verano;Candelaria;NA;53;Candelaria;Candelaria, Santa Cruz de Tenerife, Islas Canarias;Candelaria;38011;Indeterminado;Indeterminado;No;Encontrada flotando a 1 milla frente a Punta Prieta, recogida en Cruz Roja de Candelaria.Juvenil;NA;NA;NA
558;1531 - 1998-2010;Caretta caretta;Tortuga Boba;21/08/2000;21/08/2000;2000;Agosto;Verano;Candelaria;NA;53;Candelaria;Candelaria, Santa Cruz de Tenerife, Islas Canarias;Candelaria;38011;Indeterminado;Indeterminado;No;Encontrada flotando a 1 milla frente a Punta Prieta , recogida en Cruz Roja de Candelaria.Juvenil;NA;NA;NA
562;1477 - 1998-2010;Caretta caretta;Tortuga Boba;31/07/2000;31/07/2000;2000;Julio;Verano;Muelle de Los Cristianos;NA;268;Muelle De Los Cristianos;Carretera a los Cristianos, 38627, Arona, Santa Cruz de Tenerife, Islas Canarias;Arona;38006;Indeterminado;Indeterminado;No;NA;NA;NA;NA
565;1468 - 1998-2010;Caretta caretta;Tortuga Boba;28/07/2000;28/07/2000;2000;Julio;Verano;El Palmar;NA;102;El Palmar;El Palmar, Garafía, Santa Cruz de Tenerife, Islas Canarias;Santa Cruz de Tenerife;38038;Indeterminado;Indeterminado;Si;La mitad posterior del caparazón destrozado.;NA;Caparazón;NA
568;1461 - 1998-2010;Caretta caretta;Tortuga Boba;26/07/2000;26/07/2000;2000;Julio;Verano;Pto. Colón;NA;402;Pto. Colon;Centro Comercial Puerto Colón;Adeje;38001;Indeterminado;Indeterminado;No;Traslado a Tafira 27-07-00. Cortes y fractura de aleta detantera derecha;Varias lesiones;Aleta;NA
569;1460 - 1998-2010;Caretta caretta;Tortuga Boba;26/07/2000;26/07/2000;2000;Julio;Verano;Playa de San Juan;NA;326;Playa De San Juan;Playa de San Juan, Guía de Isora, Santa Cruz de Tenerife, Islas Canarias;Guía de Isora;38019;Indeterminado;Indeterminado;No;Problema en aleta delantera izda.;NA;Aleta;NA
570;1451 - 1998-2010;Caretta caretta;Tortuga Boba;24/07/2000;24/07/2000;2000;Julio;Verano;Punta del Hidalgo;NA;458;Punta Del Hidalgo;Punta del Hidalgo, San Cristóbal de La Laguna, Santa Cruz de Tenerife, Islas Canarias;San Cristóbal de La Laguna;38023;Indeterminado;Indeterminado;Si;Recogida muerta, descompuesta;NA;NA;Muerta
572;1425 - 1998-2010;Caretta caretta;Tortuga Boba;13/07/2000;13/07/2000;2000;Julio;Verano;Pto. Colón;NA;402;Pto. Colon;Centro Comercial Puerto Colón;Adeje;38001;Indeterminado;Indeterminado;Si;RECOGIDA MUERTA;NA;NA;Muerta
574;1401 - 1998-2010;Caretta caretta;Tortuga Boba;04/07/2000;04/07/2000;2000;Julio;Verano;Playa del Socorro;NA;335;Playa Del Socorro;Plaza del Socorro, 38508, Güímar, Santa Cruz de Tenerife, Islas Canarias;Güímar;38020;Indeterminado;Indeterminado;No;Herida en aleta delantera dcha. Se remite al C.R.F.S. de Tafira en Gran Canaria el 05/07/2000;Herida;Aleta;NA
575;1394 - 1998-2010;Caretta caretta;Tortuga Boba;03/07/2000;03/07/2000;2000;Julio;Verano;El Socorro;NA;119;El Socorro;El Socorro, Güímar, Santa Cruz de Tenerife, Islas Canarias;Güímar;38020;Indeterminado;Indeterminado;No;Le falta la aleta delantera dcha.,y tiene heridas en el resto. Se remite al C.R.F.S. de Tafira en Gran Canaria el 04/07/2000;Herida;Aleta;NA
579;1360 - 1998-2010;Caretta caretta;Tortuga Boba;22/06/2000;22/06/2000;2000;Junio;Verano;Instituto Oceanográfico;NA;155;Instituto Oceanografico;NA;Santa Cruz de Tenerife;38038;Indeterminado;Indeterminado;No;Se remite al C.R.F.S. de Tafira en Gran Canaria el 23/06/2000;NA;NA;NA
580;1352 - 1998-2010;Caretta caretta;Tortuga Boba;20/06/2000;20/06/2000;2000;Junio;Verano;Punta de Abona;NA;454;Punta De Abona;Punta de Abona, Arico, Santa Cruz de Tenerife, Islas Canarias;Arico;38005;Indeterminado;Indeterminado;Si;NA;NA;NA;NA
587;1163 - 1998-2010;Caretta caretta;Tortuga Boba;31/03/2000;31/03/2000;2000;Marzo;Primavera;Muelle de Los Gigantes;NA;269;Muelle De Los Gigantes;Carretera los Gigantes, 38686, Guía de Isora, Santa Cruz de Tenerife, Islas Canarias;Guía de Isora;38019;Indeterminado;Indeterminado;No;NA;NA;NA;NA
594;1017 - 1998-2010;Caretta caretta;Tortuga Boba;31/10/1999;31/10/1999;1999;Octubre;Otoño;Unas millas de Los Gigantes;NA;507;Unas Millas De Los Gigantes;Carretera los Gigantes, 38686, Guía de Isora, Santa Cruz de Tenerife, Islas Canarias;Guía de Isora;38019;Indeterminado;Indeterminado;No;Entregada por Manolo Carrillo. Aleta delantera dcha.inflamada y con un corte en la base, ligero corte en el cuello. Traslado al CRFS de Tafira, Gran Canaria el 02/11/99.;Cortes;Varias partes;Infección
597;965 - 1998-2010;Caretta caretta;Tortuga Boba;21/09/1999;21/09/1999;1999;Septiembre;Otoño;Alta mar 2 millas frente Puerto Colón;NA;17;Alta Mar 2 Millas Frente Puerto Colon;Puerto, Tazacorte, Santa Cruz de Tenerife, Islas Canarias;Adeje;38001;Indeterminado;Indeterminado;No;Se remite al CRFS de Tafira,, Gran Canaria,, el día 22/09/99. Le falta más de la mitad de la aleta delantera izquierda. Peso:9 kgrs.;NA;Aleta;NA
601;923 - 1998-2010;Caretta caretta;Tortuga Boba;25/08/1999;25/08/1999;1999;Agosto;Verano;El Puertito;NA;115;El Puertito;El Puertito, Los Silos, Santa Cruz de Tenerife, Islas Canarias;Silos, Los;38042;Indeterminado;Indeterminado;No;Se remite al CRFS de Tafira, Gran Canaria el 26/08/99;NA;NA;NA
603;905 - 1998-2010;Caretta caretta;Tortuga Boba;13/08/1999;13/08/1999;1999;Agosto;Verano;Los Abrigos, El Médano;NA;217;Los Abrigos, El Medano;Avenida de los Abrigos, 38612, Granadilla de Abona, Santa Cruz de Tenerife, Islas Canarias;Granadilla de Abona;38017;Indeterminado;Indeterminado;No;En buen estado.;NA;NA;NA
604;904 - 1998-2010;Caretta caretta;Tortuga Boba;12/08/1999;12/08/1999;1999;Agosto;Verano;Punta de Abona, El Poris;NA;455;Punta De Abona, El Poris;Punta de Abona, Arico, Santa Cruz de Tenerife, Islas Canarias;Arico;38005;Indeterminado;Indeterminado;Si;Muy débil y con inflamación en la cloaca. Se remite al CRFS de Tafira, Gran Canaria el dia 13/08/99;NA;NA;NA
605;900 - 1998-2010;Caretta caretta;Tortuga Boba;11/08/1999;11/08/1999;1999;Agosto;Verano;Dos millas frente Pto. Colón;NA;89;Dos Millas Frente Pto. Colon;Puerto, Tazacorte, Santa Cruz de Tenerife, Islas Canarias;Adeje;38001;Indeterminado;Indeterminado;No;Necrosada aleta delantera iqda.Se remite al CRFS de Tafira, Gran Canaria el dia 13/08/99;NA;Aleta;Necrosada
608;854 - 1998-2010;Caretta caretta;Tortuga Boba;22/07/1999;22/07/1999;1999;Julio;Verano;Playa Bahía del Duque;NA;299;Playa Bahia Del Duque;Spa-Bahia del Duque;Adeje;38001;Indeterminado;Indeterminado;No;Aleta delantera iqda. Necrosada. Se remite al CRFS de Tafira Gran Canaria el 230799;NA;Aleta;Necrosada
617;9427 - 1998-2010;Caretta caretta;Tortuga Boba;28/09/2010;28/09/2010;2010;Septiembre;Otoño;Tabaibal del Poris;NA;489;Tabaibal Del Poris;El Poris, Villa de Mazo, Santa Cruz de Tenerife, Islas Canarias;Arico;38005;Indeterminado;Indeterminado;No;41 x 35 cm. Descompuesta, sin cabeza ni aletas;NA;Varias partes;NA
619;9362 - 1998-2010;Caretta caretta;Tortuga Boba;27/08/2010;27/08/2010;2010;Agosto;Verano;La Caleta de Interian;NA;171;La Caleta De Interian;Caleta de Interian, Garachico, Santa Cruz de Tenerife, Islas Canarias;Garachico;38015;Indeterminado;Indeterminado;No;Descompuesta;NA;NA;NA
621;9196 - 1998-2010;Caretta caretta;Tortuga Boba;09/07/2010;09/07/2010;2010;Julio;Verano;La Caleta;NA;168;La Caleta;La Caleta, Adeje, Santa Cruz de Tenerife, Islas Canarias;Adeje;38001;Indeterminado;Indeterminado;No;NA;NA;NA;NA
647;3110 - 1998-2010;Caretta caretta;Tortuga Boba;30/10/2002;30/10/2002;2002;Octubre;Otoño;Tabaibal del Poris;NA;489;Tabaibal Del Poris;El Poris, Villa de Mazo, Santa Cruz de Tenerife, Islas Canarias;Arico;38005;Indeterminado;Indeterminado;No;APN;NA;NA;NA
648;2785 - 1998-2010;Caretta caretta;Tortuga Boba;02/07/2002;02/07/2002;2002;Julio;Verano;Pto. Colón;NA;402;Pto. Colon;Centro Comercial Puerto Colón;Adeje;38001;Indeterminado;Indeterminado;No;Recogida descompuesta, entregada en el PIRS;NA;NA;NA
657;2058 - 1998-2010;Caretta caretta;Tortuga Boba;08/06/2001;08/06/2001;2001;Junio;Verano;Pto. Colón;NA;402;Pto. Colon;Centro Comercial Puerto Colón;Adeje;38001;Indeterminado;Indeterminado;No;Se hunde y come;NA;NA;NA
659;1050 - 1998-2010;Caretta caretta;Tortuga Boba;09/11/1999;09/11/1999;1999;Noviembre;Otoño;Valle Gran Rey;NA;512;Valle Gran Rey;Valle Gran Rey, Santa Cruz de Tenerife, Islas Canarias;Santa Cruz de Tenerife;38038;Indeterminado;Indeterminado;No;Le falta la aleta delantera derecha. Se remite al CRFS de Tafira, Gran Canaria, el día 10/11/99.;NA;Aleta;NA
680;5463 - 1998-2010;Caretta caretta;Tortuga Boba;02/10/2005;02/10/2005;2005;Octubre;Otoño;Playa Taganana;NA;379;Playa Taganana;Playa;Santa Cruz de Tenerife;38038;Indeterminado;Indeterminado;No;Descompuesta;NA;NA;NA
688;2111 - 1998-2010;Caretta caretta;Tortuga Boba;22/06/2001;22/06/2001;2001;Junio;Verano;Pto. Colón;NA;402;Pto. Colon;Centro Comercial Puerto Colón;Adeje;38001;Indeterminado;Indeterminado;No;NA;NA;NA;NA
692;1463 - 1998-2010;Caretta caretta;Tortuga Boba;26/07/2000;26/07/2000;2000;Julio;Verano;Los Gigantes;NA;227;Los Gigantes;Los Gigantes;Santiago del Teide;38040;Indeterminado;Indeterminado;No;Recogida a una milla y media de Bco. Seco. No tiene nada;NA;NA;NA
694;960 - 1998-2010;Caretta caretta;Tortuga Boba;19/09/1999;19/09/1999;1999;Septiembre;Otoño;Abades;NA;5;Abades;Calle Abades, 38588, Arico, Santa Cruz de Tenerife, Islas Canarias;Arico;38005;Indeterminado;Indeterminado;No;Se remite al CRFS de Tafira, Gran Canaria, el día 20/09/99. Tiene la aleta delantera izquierda necrosada. Peso: 16 kgr.;NA;Aleta;Necrosada
731;2569 - 1998-2010;Caretta caretta;Tortuga Boba;21/04/2002;21/04/2002;2002;Abril;Primavera;Candelaria;NA;53;Candelaria;Candelaria, Santa Cruz de Tenerife, Islas Canarias;Candelaria;38011;Indeterminado;Indeterminado;No;Putrefacta;NA;NA;Putrefacta
812;4395 - 1998-2010;Caretta caretta;Tortuga Boba;02/07/2004;02/07/2004;2004;Julio;Verano;Radazul;NA;468;Radazul;Centro Comercial Radazul;Rosario, El;38032;Indeterminado;Indeterminado;No;Con algunos percebes en parte trasera del caparazón, se hunde y come.;NA;Caparazón;NA
850;1616 - 1998-2010;Caretta caretta;Tortuga Boba;23/09/2000;23/09/2000;2000;Septiembre;Otoño;Amarilla Golf, Puerto Nuevo;NA;20;Amarilla Golf, Puerto Nuevo;Puerto, Tazacorte, Santa Cruz de Tenerife, Islas Canarias;Adeje;38001;Indeterminado;Indeterminado;Si;Recogida muerta.;NA;NA;Muerta
852;1587 - 1998-2010;Caretta caretta;Tortuga Boba;12/09/2000;12/09/2000;2000;Septiembre;Otoño;Puerto Deportivo Los Gigantes;NA;448;Puerto Deportivo Los Gigantes;Puerto, Tazacorte, Santa Cruz de Tenerife, Islas Canarias;Santiago del Teide;38040;Indeterminado;Indeterminado;No;Peso: 1,400 Kgr.;NA;NA;NA
853;1586 - 1998-2010;Caretta caretta;Tortuga Boba;12/09/2000;12/09/2000;2000;Septiembre;Otoño;Puerto Deportivo de Los Gigantes;NA;446;Puerto Deportivo De Los Gigantes;Los Gigantes;Santiago del Teide;38040;Indeterminado;Indeterminado;No;Peso: 12 Kgr.;NA;NA;NA
856;1447 - 1998-2010;Caretta caretta;Tortuga Boba;21/07/2000;21/07/2000;2000;Julio;Verano;Playa Peña María, El Médano;NA;371;Playa Peña Maria, El Medano;El Médano, Granadilla de Abona, Santa Cruz de Tenerife, Islas Canarias;Granadilla de Abona;38017;Indeterminado;Indeterminado;No;Pequeño golpe superficial en la cabeza. Un poco delgada. Peso aproximado 7 kgrs. Infección Pulmonar. No come. Se remite al CRFS de Tafira en Gran Canaria el 25/08/00.Regresa a Tenerife el 3 de Octubre de 2000;NA;Cabeza;Infección
857;1388 - 1998-2010;Caretta caretta;Tortuga Boba;03/07/2000;03/07/2000;2000;Julio;Verano;Santa Cruz;NA;481;Santa Cruz;Santa Cruz, Santa Cruz de Tenerife, Islas Canarias;Santa Cruz de Tenerife;38038;Indeterminado;Indeterminado;Si;Muy delgada y débil.;NA;NA;Débil
858;1320 - 1998-2010;Caretta caretta;Tortuga Boba;09/06/2000;09/06/2000;2000;Junio;Verano;Playa de San Juan;NA;326;Playa De San Juan;Playa de San Juan, Guía de Isora, Santa Cruz de Tenerife, Islas Canarias;Guía de Isora;38019;Indeterminado;Indeterminado;Si;Recogida descompuesta y sin aletas;NA;Aleta;NA
864;811 - 1998-2010;Caretta caretta;Tortuga Boba;10/07/1999;10/07/1999;1999;Julio;Verano;Puerto Colón,, Las Américas;NA;433;Puerto Colon,, Las Americas;Puerto, Tazacorte, Santa Cruz de Tenerife, Islas Canarias;Adeje;38001;Indeterminado;Indeterminado;No;Le falta la aleta delantera dcha. Se remite al CRFS de Tafira, Gran Canaria, el día 12/07/99.;NA;Aleta;NA
